{
  "$schema":"https://json-schema.org/draft/2020-12/schema","$id":"https://design.mez.systems/schemas/global-navigation-0.1.0.json","type":"object","additionalProperties":false,
  "required":["schemaVersion","componentId","version","status","productionAuthority","gateId","candidateRevision","taskId","title","selectedFamily","thesis","anatomy","states","behaviour","motion","motionDecisionException","variants","prohibited","events","testViewports","dependencies"],
  "properties":{"schemaVersion":{"const":"1.0.0"},"componentId":{"const":"mz.systems.component.global-navigation"},"version":{"const":"0.1.0-candidate"},"status":{"const":"review-candidate"},"productionAuthority":{"const":false},"gateId":{"const":"H-CMP-01-GLOBAL-NAVIGATION-PROOF"},"candidateRevision":{"const":"global-navigation-01-r04"},"taskId":{"const":"TASK-CMP-01-GLOBAL-NAVIGATION"},"title":{"type":"string"},"selectedFamily":{"const":"registry"},"thesis":{"type":"string","minLength":120},"anatomy":{"type":"array","minItems":8,"items":{"type":"string"}},"states":{"type":"array","minItems":7,"items":{"type":"string"},"uniqueItems":true},"behaviour":{"type":"object","required":["open","close","keyboard","selection","scroll"]},"motion":{"type":"object","required":["maximumLiveCores","default","repeated","reduced","failure"],"properties":{"maximumLiveCores":{"const":5}}},"motionDecisionException":{"type":"object","required":["status","requestedBy","requestedAt","summary"],"properties":{"status":{"const":"review-candidate"},"requestedBy":{"const":"Olli"},"requestedAt":{"type":"string"},"summary":{"type":"string","minLength":120}}},"variants":{"type":"array","minItems":2,"maxItems":2},"prohibited":{"type":"array","minItems":10,"items":{"type":"string"},"uniqueItems":true},"events":{"type":"array","minItems":3,"maxItems":3},"testViewports":{"const":[320,360,375,390,430,768,1024,1280,1440]},"dependencies":{"type":"object","required":["researchJs","researchCss","productComponents","websiteMotion","stressProof","foundations","products","renderer","wings"]}}
}
