{
  "schemaVersion":"1.0.0",
  "componentId":"mz.systems.component.global-navigation",
  "version":"0.1.0-candidate",
  "status":"review-candidate",
  "productionAuthority":false,
  "gateId":"H-CMP-01-GLOBAL-NAVIGATION-PROOF",
  "candidateRevision":"global-navigation-01-r04",
  "taskId":"TASK-CMP-01-GLOBAL-NAVIGATION",
  "title":"Mez Systems global navigation",
  "selectedFamily":"registry",
  "thesis":"A quiet parent bar opens smoothly into one equal five-product registry. A layered stack of five static product circles makes the family visible inside the compact Explore control; all five spherical Living Cores animate automatically while expanded, public names lead, and the menu ends with the products rather than explanatory interface copy.",
  "anatomy":["parent Wings and Mez Systems name","optional primary site links supplied by the consumer","Explore disclosure control with five-circle family stack","expanded product registry","five equal product items","selected product material","availability and extended name","close control and scrim","no instructional footer"],
  "states":["compact","expanded","product-focused","mobile-sheet","reduced-motion","no-webgl","registry-failure"],
  "behaviour":{"open":"User-triggered disclosure only, using a calm eased shell expansion and a short five-item entrance sequence.","close":"Close button, Escape or outside click; collapse without delayed item exits and restore focus to the trigger.","keyboard":"Tab remains trapped while expanded; arrow keys move product focus; Home and End jump within the five-item registry without visible instruction copy.","selection":"Focus or pointer intent selects one product. Activation emits mez-product-navigate with canonical product data; the consumer owns the destination.","scroll":"Desktop uses a contained overlay. Mobile uses a vertical sheet with native page scroll locked while open."},
  "motion":{"maximumLiveCores":5,"default":"All five spherical product materials mount Deep Mineral automatically when the registry expands; hover only accelerates the field.","repeated":"The five equal products share one renderer and remain continuously alive together while visible.","reduced":"Do not initialise the renderer; disclosure state changes immediately and all five spheres use exact static colour twins.","failure":"Keep all product names, roles, availability, Wings and actions with exact static circular material."},
  "motionDecisionException":{"status":"review-candidate","requestedBy":"Olli","requestedAt":"2026-07-23","summary":"CMP-01 Round 02 deliberately tests five simultaneous animated spheres in the bounded expanded navigation, overriding the normal one-focal-core website allocation only if this human gate is approved."},
  "variants":[{"id":"primary-dark","authority":"candidate-primary","description":"Charcoal compact bar and expanded registry on the canonical light website canvas."},{"id":"light-surface","authority":"bounded-option","description":"White bar for contained dark website sections; identical anatomy and behaviour."}],
  "prohibited":["rounded-rectangle product material","animation that waits for hover","numbered System 01 language","parallel registry/signal/aperture/gallery/console production variants","price or commerce controls","hover-only access","decorative product pills","autoplay disclosure","fabricated destinations","horizontal mobile product rail","golden-homepage content inside the navigation"],
  "events":[{"name":"mez-navigation-open","detail":["expanded"]},{"name":"mez-product-focus","detail":["productId","slug","gradientId"]},{"name":"mez-product-navigate","detail":["productId","slug","publicName","gradientId"]}],
  "testViewports":[320,360,375,390,430,768,1024,1280,1440],
  "dependencies":{
    "researchJs":{"path":"explore-menu/explore-menu.js","sha256":"e585d475cef1981849878ef85e9e854e5dd8691a01e74b454a418c74131b11cc"},
    "researchCss":{"path":"explore-menu/explore-menu.css","sha256":"fedc92d6ec6fe96520e3fea230ba157f87f831858d508818a176a45134988b90"},
    "productComponents":{"path":"brand-kit/expressions/product-card/phase-b/product-component-pantry.source.json","sha256":"cf5fc2478e59cc98a0ce206de0055fae66478dd2ad64f45255ca7a1a054aa250"},
    "websiteMotion":{"path":"brand-kit/expressions/channel-motion/channel-motion.source.json","sha256":"f04a82f58f4283862014844dcd3911e6986d035076d784ab83638d9ed842d17d"},
    "stressProof":{"path":"brand-kit/expressions/stress-proof/expression-stress.source.json","sha256":"c57b1a069cf57473d0a008a88c9fb19d7daf4977384ef8e7c2da1f849c6b6268"},
    "foundations":{"path":"brand-kit/releases/foundations/dist/manifest.json","sha256":"2dd58325f4c04d59b7db50011f42ed5a782e4b722182d2089a546ed896d5e639"},
    "products":{"path":"brand-kit/registry/products.json","sha256":"665f09ac409c431af7a66a844795ae29f89c7c93a879f5dbfc3de201830bfb0b"},
    "renderer":{"path":"brand-kit/source-pack/design-system-export/mz-core.js","sha256":"7538046908405d0a450f63fd5b1a1ca6c0d98054397e78059917f284e58b609d"},
    "wings":{"path":"brand-kit/source-pack/design-system-export/assets/wings.svg","sha256":"e6475e216a77a39dda11a634e9cae18e54fff7f5386252f56344492d4d358a33"}
  }
}
